delivery_no	programme_status	note_status	note_ref	evidence_reviewed_at	remarks
77	note_reviewed	reviewed	docs/country-page-notes/77-kazakhstan.md	2026-06-30	Reviewed public-safe note completed; federation championship scope and C ceiling retained.
78	note_reviewed	reviewed	docs/country-page-notes/78-egypt.md	2026-06-30	Reviewed public-safe note completed; international federation context remains link-only.
79	note_reviewed	reviewed	docs/country-page-notes/79-algeria.md	2026-06-30	Reviewed public-safe note completed; domestic current calendar remains unresolved.
80	note_reviewed	reviewed	docs/country-page-notes/80-iran.md	2026-06-30	Reviewed public-safe note completed; third-party prediction and betting portals remain excluded.
81	note_reviewed	reviewed	docs/country-page-notes/81-vietnam.md	2026-06-30	Reviewed public-safe note completed; bounded Bac Ha festival scope retained.
82	note_reviewed	reviewed	docs/country-page-notes/82-bolivia.md	2026-06-30	Reviewed public-safe note completed; current-calendar output remains blocked.
83	note_reviewed	reviewed	docs/country-page-notes/83-guatemala.md	2026-06-30	Reviewed public-safe note completed; cultural context remains link-only pending a dated notice.
84	note_reviewed	reviewed	docs/country-page-notes/84-honduras.md	2026-06-30	Reviewed public-safe note completed; no current racing calendar is approved.
